{
  "schema_version": "2.0.0",
  "prompt_id": "reviews-empty-chair-follow-up-nl-01",
  "brand": "Zenta Creative",
  "created_at": "2026-07-14T07:00:00-03:00",
  "status": "draft_for_human_review",
  "content_type": "paid_ad_image",
  "assumptions": [
    "The concept targets businesses in Suriname unless a narrower audience is supplied.",
    "Placement dimensions, safe areas, eligibility, and overlays require current platform preview before publication.",
    "Exact copy and the official Zenta logo will be added during final design production, not image prompting."
  ],
  "campaign": {
    "objective": "lead generation",
    "conversion": "review-system inquiry",
    "service_id": "review-system",
    "audience": "local service businesses in Suriname that want a consistent way to invite genuine reviews",
    "funnel_stage": "consideration",
    "platforms": [
      "Meta"
    ],
    "placements": [
      "Facebook Feed",
      "Instagram Feed"
    ],
    "geography": "Suriname",
    "language": "Dutch"
  },
  "creative_strategy": {
    "concept_name": "Na het bezoek",
    "audience_insight": "Na vertrek van de klant verdwijnt het moment om feedback te vragen snel uit de aandacht.",
    "message_angle": "Een rustige follow-up houdt de uitnodiging zichtbaar zonder druk uit te oefenen.",
    "framework": "Feature-Advantage-Benefit",
    "hook": "De service eindigt. De opvolging hoeft niet te verdwijnen.",
    "hypothesis": "Een lege stoel na een afgeronde service maakt het gemiste opvolgmoment emotioneel herkenbaar."
  },
  "format": {
    "aspect_ratio": "4:5",
    "orientation": "portrait",
    "spec_status": "needs_platform_preview",
    "crop_guidance": "Keep the focal subject and reserved copy area inside the central composition with generous edge clearance."
  },
  "visual_direction": {
    "subject": "een lege klantenstoel naast een afgeronde werkplek en een subtiele reviewkaart",
    "action": "een zachte lichtlijn loopt van de afgeronde serviceplek naar de klaargelegde opvolgkaart",
    "environment": "een nette salon- of adviesruimte na vertrek van de klant zonder herkenbaar merk",
    "composition": "stoel rechts, afgeronde werkplek midden, open donkere ruimte linksboven",
    "lighting": "warm nabezoeklicht met een rustige lime lijn en zachte schaduwen",
    "palette": [
      "#030507",
      "#F4F7FB",
      "#B9FF66",
      "#5EE7FF",
      "#9B7CFF"
    ],
    "style": "cinematische lifestylefotografie met een bedachtzame, menselijke sfeer"
  },
  "copy": {
    "overlay_headline": "De service eindigt. De opvolging hoeft niet te verdwijnen.",
    "overlay_support": "Review link + QR prompt + follow-up copy",
    "cta": "Maak opvolging eenvoudig",
    "caption": "Na een goede service is een duidelijke, respectvolle uitnodiging makkelijker dan later improviseren. Zenta helpt met de reviewlink, QR-prompt en opvolgtekst."
  },
  "image_prompt": "Create a polished 4:5 base image concept for a Zenta Creative paid ad image. The central subject is een lege klantenstoel naast een afgeronde werkplek en een subtiele reviewkaart. Show een zachte lichtlijn loopt van de afgeronde serviceplek naar de klaargelegde opvolgkaart. Set the scene in een nette salon- of adviesruimte na vertrek van de klant zonder herkenbaar merk. Composition: stoel rechts, afgeronde werkplek midden, open donkere ruimte linksboven. Lighting: warm nabezoeklicht met een rustige lime lijn en zachte schaduwen. Visual style: cinematische lifestylefotografie met een bedachtzame, menselijke sfeer. Use Zenta's near-black foundation with the controlled palette #030507, #F4F7FB, #B9FF66, #5EE7FF, #9B7CFF; keep lime as the decisive action accent rather than flooding the image with one hue. The image must communicate the strategic angle 'Een rustige follow-up houdt de uitnodiging zichtbaar zonder druk uit te oefenen.' without claiming a result. Reserve clean, high-contrast negative space for the headline 'De service eindigt. De opvolging hoeft niet te verdwijnen.', support line 'Review link + QR prompt + follow-up copy', and CTA 'Maak opvolging eenvoudig' to be typeset later by a designer. Do not render any words, letters, prices, logo, wordmark, platform mark, interface copy, or functional QR code inside the base image. Keep the focal subject and copy-safe space comfortably away from edges for placement preview. Avoid verdrietige sfeer, klantfoto's, sterren, testimonials of druk uitoefenende meldingen, fake evidence, visual clutter, and distorted objects or anatomy.",
  "negative_constraints": [
    "no generated logo, wordmark, trademark, or third-party platform branding",
    "no fabricated metrics, rankings, leads, revenue, testimonials, or guarantees",
    "no copied Google, Meta, Facebook, Instagram, or WhatsApp interface",
    "no tiny unreadable text, random letters, watermark, or signature",
    "no stereotypes, unapproved likenesses, or identifiable private customer data",
    "verdrietige sfeer, klantfoto's, sterren, testimonials of druk uitoefenende meldingen"
  ],
  "accessibility": {
    "alt_text": "Een lege klantenstoel staat naast een afgeronde werkplek en een klaargelegde reviewkaart.",
    "contrast_note": "Typeset final copy in white or near-black on a solid high-contrast area and verify readability at mobile size."
  },
  "compliance": {
    "claim_risk": "low",
    "required_review": [
      "Do not fabricate reviews, ratings, testimonials, customer identities, or incentives.",
      "Confirm the base image contains no generated branding, fake proof, copied platform trade dress, or private data.",
      "Preview final typography, logo placement, crop, and overlays in every intended placement."
    ]
  },
  "production": {
    "typography_instruction": "Add the exact overlay copy later using Zenta's bold modern geometric sans-serif system; do not ask an image model to typeset it.",
    "logo_instruction": "Reserve space for the approved Zenta logo and place the original brand asset only during final design production.",
    "human_review_required": true
  }
}
